source,title,link,date,last_updated
OurNews,"International7 hours ago

Europe’s Russian Gas Era Comes To End As Ukraine Transit Stops
RUSSIA - Russian gas supplies to Europe via Ukraine ended on New Year's Day, bringing down the curtain on Moscow's long period of dominance of supply...",https://ournews.bs/europes-russian-gas-era-comes-to-end-as-ukraine-transit-stops/,2025-01-03,2025-01-03 17:46:07
OurNews,"National7 hours ago

BDCOS Deputy Commissioner: “We’re Really Seeing The Difference In The Lives Of Inmates”
NASSAU, BAHAMAS - As we enter a new year, officials at the prison, say they've had several initiatives last year, that have been successful in helping...",https://ournews.bs/bdcos-deputy-commissioner-were-really-seeing-the-difference-in-the-lives-of-inmates/,2025-01-03,2025-01-03 17:46:07
OurNews,"Crime8 hours ago

Nearly $10M Worth Of Cocaine Seized In Joint Operation
GRAND BAHAMA, BAHAMAS -A joint operation in Grand Bahama has led to a major drug bust worth nearly $10 million, totaling an estimated $9,960,000.",https://ournews.bs/nearly-10m-worth-of-cocaine-seized-in-joint-operation/,2025-01-03,2025-01-03 17:46:07
OurNews,"National8 hours ago

Music Makers, Prodigal Sons Disqualifications Explained
NASSAU, BAHAMAS - While both the Music Makers and the Prodigal Sons made it to bay for the 2025 New Year's Day Junkanoo parades, they were...",https://ournews.bs/music-makers-prodigal-sons-disqualifications-explained/,2025-01-03,2025-01-03 17:46:07
OurNews,"Crime8 hours ago

How Common Is Bahamian Passport Fraud?
NASSAU, BAHAMAS - Days after a man was caught and charged in St. Vincent with a fraudulent Bahamian passport, Chief Passport Officer Nicholas Symonette says it's...",https://ournews.bs/how-common-is-bahamian-passport-fraud/,2025-01-03,2025-01-03 17:46:07
OurNews,"Sports8 hours ago

Bahamas Bowl Game Set For Saturday Is Free For Fans
NASSAU, BAHAMAS - The Bahamas Bowl, which is the longest running international college football bowl game, will return after a one year absence on Saturday January...",https://ournews.bs/bahamas-bowl-game-set-for-saturday-is-free-for-fans/,2025-01-03,2025-01-03 17:46:07
OurNews,"National8 hours ago

Former Independent West Grand Bahama Candidate Reaffirms Commitment To West End
GRAND BAHAMA, BAHAMAS -Just hours before the tragic accident involving an infant in West End, former West Grand Bahama and Bimini by-election independent candidate, Daquan Swain,...",https://ournews.bs/former-independent-west-grand-bahama-candidate-reaffirms-commitment-to-west-end/,2025-01-03,2025-01-03 17:46:07
OurNews,"International8 hours ago

Silver Airways Files For Chapter 11 Bankruptcy
NASSAU, BAHAMAS - 2025 was met with not-so-great news for Silver Airways, as the airline announced in a letter to its customers that it plans on...",https://ournews.bs/silver-airways-files-for-chapter-11-bankruptcy/,2025-01-03,2025-01-03 17:46:07
ZNS Bahamas,"Leif Farquharson, KC, sworn in as Justice of the Supreme Court",https://znsbahamas.com/leif-farquharson-kc-sworn-in-as-justice-of-the-supreme-court/,Date not available,2025-01-03 17:46:07
ZNS Bahamas,"Dale Fitzpatrick, sworn in as Justice of the Supreme Court",https://znsbahamas.com/dale-fitzpatrick-sworn-in-as-justice-of-the-supreme-court/,Date not available,2025-01-03 17:46:07
ZNS Bahamas,2025 New Year’s Day Junkanoo Parade – PHOTOS,https://znsbahamas.com/2025-new-years-day-junkanoo-parade-photos/,Date not available,2025-01-03 17:46:07
ZNS Bahamas,Three Haitian nationals charged in Magistrate Court,https://znsbahamas.com/three-haitian-nationals-charged-in-magistrate-court/,Date not available,2025-01-03 17:46:07
ZNS Bahamas,Bahamas Ministry of Tourism Wraps Up 2024 on a High Note with a Remarkable Series of  Prestigious Awards,https://znsbahamas.com/bahamas-ministry-of-tourism-wraps-up-2024-on-a-high-note-with-a-remarkable-series-of-prestigious-awards/,Date not available,2025-01-03 17:46:07
ZNS Bahamas,"Valley Boys, The Way Forward",https://znsbahamas.com/valley-boys-the-way-forward-2/,Date not available,2025-01-03 17:46:07
ZNS Bahamas,New Insurance Act In Effect,https://znsbahamas.com/new-insurance-act-in-effect/,Date not available,2025-01-03 17:46:07
ZNS Bahamas,$10 Million In Cocaine Seized At Local Port,https://znsbahamas.com/10-million-in-cocaine-seized-at-local-port/,Date not available,2025-01-03 17:46:07
ZNS Bahamas,Michael Johnson Arrested & Released As Investigation Widens,https://znsbahamas.com/michael-johnson-arrested-released-as-investigation-widens/,Date not available,2025-01-03 17:46:07
Eyewitness News,Read article: Police address deadly three-car crash that killed toddler,https://ewnews.com/police-address-deadly-three-car-crash-that-killed-toddler/,Date not available,2025-01-03 17:46:07
Eyewitness News,Read article: Fernander: Johnson probe ‘goes beyond voice-notes’,https://ewnews.com/fernander-johnson-probe-goes-beyond-voice-notes/,Date not available,2025-01-03 17:46:07
Eyewitness News,Read article: Suspects involved in multi-million dollar drug bust revealed,https://ewnews.com/suspects-involved-in-multi-million-dollar-drug-bust-revealed/,Date not available,2025-01-03 17:46:07
Eyewitness News,Read article: Container search leads to discovery of some $10 million worth of drugs,https://ewnews.com/container-search-leads-to-discovery-of-some-10-million-worth-of-drugs/,Date not available,2025-01-03 17:46:07
Eyewitness News,Read article: 2025 Junkanoo season one for the history books,https://ewnews.com/2025-junkanoo-season-one-for-the-history-books/,Date not available,2025-01-03 17:46:07
Eyewitness News,"Read article: YEAR IN REVIEW: Perusing politics in 2024 – Drama, infighting and political punches",https://ewnews.com/year-in-review-perusing-politics-in-2024-drama-infighting-and-political-punches/,Date not available,2025-01-03 17:46:07
Eyewitness News,Read article: Police address deadly three-car crash that killed toddler,https://ewnews.com/police-address-deadly-three-car-crash-that-killed-toddler/,Date not available,2025-01-03 17:46:07
Eyewitness News,Read article: Fernander: Johnson probe ‘goes beyond voice-notes’,https://ewnews.com/fernander-johnson-probe-goes-beyond-voice-notes/,Date not available,2025-01-03 17:46:07
Eyewitness News,Read article: Suspects involved in multi-million dollar drug bust revealed,https://ewnews.com/suspects-involved-in-multi-million-dollar-drug-bust-revealed/,Date not available,2025-01-03 17:46:07
Eyewitness News,Read article: Container search leads to discovery of some $10 million worth of drugs,https://ewnews.com/container-search-leads-to-discovery-of-some-10-million-worth-of-drugs/,Date not available,2025-01-03 17:46:07
Eyewitness News,Read article: 2025 Junkanoo season one for the history books,https://ewnews.com/2025-junkanoo-season-one-for-the-history-books/,Date not available,2025-01-03 17:46:07
Eyewitness News,"Read article: YEAR IN REVIEW: Perusing politics in 2024 – Drama, infighting and political punches",https://ewnews.com/year-in-review-perusing-politics-in-2024-drama-infighting-and-political-punches/,Date not available,2025-01-03 17:46:07
Eyewitness News,Read article: Police address deadly three-car crash that killed toddler,https://ewnews.com/police-address-deadly-three-car-crash-that-killed-toddler/,Date not available,2025-01-03 17:46:07
Eyewitness News,Read article: Fernander: Johnson probe ‘goes beyond voice-notes’,https://ewnews.com/fernander-johnson-probe-goes-beyond-voice-notes/,Date not available,2025-01-03 17:46:07
Eyewitness News,Read article: Suspects involved in multi-million dollar drug bust revealed,https://ewnews.com/suspects-involved-in-multi-million-dollar-drug-bust-revealed/,Date not available,2025-01-03 17:46:07
Eyewitness News,Read article: Container search leads to discovery of some $10 million worth of drugs,https://ewnews.com/container-search-leads-to-discovery-of-some-10-million-worth-of-drugs/,Date not available,2025-01-03 17:46:07
Eyewitness News,Read article: 2025 Junkanoo season one for the history books,https://ewnews.com/2025-junkanoo-season-one-for-the-history-books/,Date not available,2025-01-03 17:46:07
Eyewitness News,"Read article: YEAR IN REVIEW: Perusing politics in 2024 – Drama, infighting and political punches",https://ewnews.com/year-in-review-perusing-politics-in-2024-drama-infighting-and-political-punches/,Date not available,2025-01-03 17:46:07
Eyewitness News,Read article: Year in Review: A recap of a legendary year in Bahamian sports history,https://ewnews.com/year-in-review-a-recap-of-a-legendary-year-in-bahamian-sports-history/,Date not available,2025-01-03 17:46:07
Eyewitness News,Read article: Colours junkanoo group wins B Division for New Year’s Day Parade,https://ewnews.com/colours-junkanoo-group-wins-b-division-for-new-years-day-parade/,Date not available,2025-01-03 17:46:07
Eyewitness News,Read article: Bishop Neil Ellis condemns ‘lawlessness’ in country,https://ewnews.com/bishop-neil-ellis-condemns-lawlessness-in-country/,Date not available,2025-01-03 17:46:07
Eyewitness News,"Read article: Windsor Lakes development 75 percent complete, over 50 percent sold",https://ewnews.com/windsor-lakes-development-75-percent-complete-over-50-percent-sold/,Date not available,2025-01-03 17:46:07
Eyewitness News,Read article: PDC Corporate and Accounting Services expands offerings and opens new Nassau office,https://ewnews.com/pdc-corporate-and-accounting-services-expands-offerings-and-opens-new-nassau-office/,Date not available,2025-01-03 17:46:07
Eyewitness News,Read article: Unionized staffers at UB allegedly stage sick-out,https://ewnews.com/unionized-staffers-at-ub-allegedly-stage-sick-out/,Date not available,2025-01-03 17:46:07
Eyewitness News,Read article: Super Value postpones digital stamp rollout,https://ewnews.com/super-value-postpones-digital-stamp-rollout/,Date not available,2025-01-03 17:46:07
Eyewitness News,Police address deadly three-car crash that killed toddler,https://ewnews.com/police-address-deadly-three-car-crash-that-killed-toddler/,Date not available,2025-01-03 17:46:07
Eyewitness News,Fernander: Johnson probe ‘goes beyond voice-notes’,https://ewnews.com/fernander-johnson-probe-goes-beyond-voice-notes/,Date not available,2025-01-03 17:46:07
Eyewitness News,Suspects involved in multi-million dollar drug bust revealed,https://ewnews.com/suspects-involved-in-multi-million-dollar-drug-bust-revealed/,Date not available,2025-01-03 17:46:07
Eyewitness News,Container search leads to discovery of some $10 million worth of drugs,https://ewnews.com/container-search-leads-to-discovery-of-some-10-million-worth-of-drugs/,Date not available,2025-01-03 17:46:07
